id,udes,ades,ds
9596,As an experienced investor in the software industry (+300 transactions) we aim to expand our presence in various sectors of vertical market software. We would like to acquire established and mission-critical software for equipment rental management companies with existing client relationships. Addressing the full lifecycle of rental management from contract and order management through to inventory utilization| maintenance and financials.We like companies with recurring and stable contract with clients and operating margins- 0% - 15% max.Only looking for software companies with their own IP| NOT interested in re-sellers.,,2
9595,As an experienced investor in the software industry (+300 transactions) we aim to expand our presence in various sectors of vertical market software. We would like to acquire established and mission-critical software for retailing companies with existing client relationships. We are actively looking to build our presence in the retail technology space as we are excited by the potential of the industry.We would like to help companies in this vertical grow and establish themselves as the leading providers of mission-critical solutions for retailers and merchants across the following market segments: Hard & Soft Good Retailers| Specialty Retailers| Food & Pharmacy Retailers| Convenience & Fuel Retailers | Restaurants & Quick Service Retailers and Sports| Travel & Entertainment Venues We like companies with recurring and stable contract with clients and operating margins- 0% - 15% max.Only looking for software companies with their own IP| NOT interested in re-sellers.,,2
9594,As an experienced investor in the software industry (+300 transactions) we aim to expand our presence in various sectors of vertical market software. We would like to acquire established and mission-critical software companies in Agri-Food business with existing client relationships. Looking for companies providing comprehensive supply chain solutions and technologies that enable businesses to efficiently produce| process and deliver quality food and drink. We like companies with recurring and stable contract with clients and operating margins- 0% - 15% max. Only looking for software companies with their own IP| NOT interested in re-sellers.,,2
9592,We are actively looking for offerings that fit below profile:- --Hospital-based physician practices (minimum $1m EBITDA requirements)--US only--Other physician practices related to the hospital-based continuum of care (ie: post-acute care| etc.),,2
9587,Headquartered in the United States| the company is a global fintech leader and provides communications| technology| data and analytics solutions for wealth management| asset management and capital markets firms. The technology-driven solutions power the entire investment lifecycle| enabling clients to successfully manage the complexity and operational requirements of today’s capital markets. Looking for software and services companies| servicing financial institutions| commonly known as B2B fintech companies|servicing trading| risk management| compliance and regulations for banks| brokers| investment managers| asset management companies and wealth management firmsPrefer companies that own the IP| against the one's that implement their partner's software.Looking at technology solutions only. The company provides following solutions currently :Global Post Trade ManagementSecurities ProcessingManaged ServicesInvestment Management SolutionsExpense ManagementReconciliation and Process ControlData ManagementRisk Management,,2
9585,US Third party logistics technology strategic acquirer seeking consolidation and transformation opportunities. Looking for technology-driven logistics firms that optimizes the efficiency of freight movement.,,2
9582,Looking for UK based multi utility metering specialist| supplying smart| gas| water and electric metering products| services| and logistics solutions across domestic| commercial| and industrial platforms.,,2
9579,Looking for transformative acquisitions of precision engineered component manufacturers in industries like medical| aerospace etc.  	Precision component manufacturer with a focus on engineering. Ability to provide customer relationships with opportunities to cross-sell existing die cast products,,2
9578,Looking for Metal Injection Molding opportunities in Europe and North America. Need desirable customer base with long-standing relationships preferably with top-tier global and/or regional customers.,,2
9577,We are looking for Die casting and Investment casting opportunities – in zinc| aluminum| and magnesium as well stainless steel and other specialty metals in new markets for expansion.The die castings should be: high volume| complex geometry| high gross margin| low weight ( < 1 kg). We are especially interested in multi-slide zinc die castings.,,2
9576,We are looking for Die casting and Investment casting opportunities – in zinc| aluminum| and magnesium as well stainless steel and other specialty metals.The die castings should be: high volume| complex geometry| high gross margin| low weight ( < 1 kg). We are especially interested in multi-slide zinc die castings.,,2
9573,Headquartered in Australia| this is a diversified automotive retailing and logistics group. It operates via subsidiaries in the following segments : motor parts and industrial supplies distribution| automotive retailing| transport and cold storage| vehicle storage and engineering| motorcycle importation and distribution and auto financing.The company is looking for auto finance brokers| preferably with online businesses: profitable businesses mainly in UK| Ireland and Singapore.,,2
9570,Based out of the United States| the company offers an extensive line of cheese and dairy-based powders| seasoning blends| concentrated pastes| flavor enhancers and hard Italian cheeses. Looking to acquire businesses that are into manufacturing of the mentioned products. The focus is on innovative dairy-based ingredient solutions| cheese and dairy powders| concentrated cheese flavours. These products can be used as ingredients or flavour enhancers for different end products.The targeted companies are food manufacturers and not end consumers.The country in focus is United States but the company is open to other geographies as well| provided the business matches. The company serves major food manufacturers| food service providers| restaurant chains and industrial ingredient and private label food manufacturers,,2
9569,We are looking for legal| regulatory| financial and management (sector specialist) consulting firms. Not interested in technology implementation services,,2
9565,We are looking for HR solutions company with a focus on Executive Search| Recruitment| Training & Learning and Temporary Staffing services. Also| interested in Professional staffing and technology platforms that help in increasing efficiency.,,2
9564,Looking for branded packaged food products like Noodle| chips| vermicelli and baby (under 4 years) food products in Asia. Also| interested in rice related products.,,2
9563,We are focused on a)	HCM on cloud as SaaS ; b)	Payroll & benefits as managed Service; c)	Compliance & regulatory lodgments on Payroll taxes where applicable,,2
9561,We are looking for businesses with established and sustainable profitability| solid market positions| and most importantly| strong management teams that are seeking a long-term partner to invest in and help grow the business.We look to invest permanent capital in businesses that meet the following criteria:· Revenue – Greater than $25 million· EBITDA – $10 million to $100 million and greater. Margin >10%. · Geography – North America for platform investments; global for add-ons· Ownership – Majority control· Management – Existing management teams to remain in place post closing· NOT interested in retail and restaurant chains,,2
9559,We are looking for UK based companies in regulated businesses like electricity| rail| water| telecom| gas etc. We would prefer companies with long terms contracts and have an EBITDA margin above 4%.,,2
9558,We are looking for contract research organization (CRO) that provides analytical support to the pharmaceutical| biotechnology| and medical device industries in the form of research services. These services help in drug discovery| validation and commercialization. Also| companies providing proteomics and immune monitoring services.NOT interested in diagnostic centers and labs. Only interested in the Analytical domain of the process.,,2
9557,We are looking for businesses that provide software solutions that are used in travel and tourism industry like hotel booking| car booking| aggregators| travel ecommerce| trip packages etc.Not looking for portals.,,2
9552,Based out of USA| the company provides innovative solutions for the world's most critical and demanding applications| from nuclear reactor pressure vessels to jet engines. It is a globally trusted source for engineered components| seals| assemblies and sub-systems that are custom-designed for the semiconductor| aerospace| power generation| oil and gas| medical and other industries.Looking to acquire businesses in the that provide the below engineered products in the mentioned industries :1) Aerospace components (engines| APUs| flight control systems| fuel systems| landing gear actuation)2) Semiconductor components (chamber systems- metal pedestals and heater assemblies| electrostatic chuck pedestals| and advanced subsystem assemblies.)3) Industrial Gas Turbine components (seals and wear components),,2
9548,It is an international group of specialised distribution businesses supplying technical products and services to the Seals| Controls and Life Sciences sectors.Life Sciences: Suppliers of consumables| instrumentation and related services to the healthcare and environmental industries.Seals: Suppliers of seals| gaskets| filters| cylinders| components and kits for heavy mobile machinery and industrial equipment.Controls: Suppliers of specialised wiring| connectors| fasteners and control devices for technically demanding applications.Financial Criteria- Stable gross margins in excess of 30%- Track record of growth| stable operating profit margins (>10%) and positive cash flowSpecific Areas of Interest-- Distributors of sealing products (seals| O rings| gaskets and filters)| especially in mainland Europe and the ASEA region-- Distributors of niche surgical medical devices| especially in the UK| Benelux| the Nordic region and Singapore / Malaysia-- Distributors of specialised fasteners| especially in mainland Europe,,2
9546,Headquartered in United States| this is a leading natural & organic foods and personal care products company and covers almost all natural food categories. The company focuses on organic and "better for you" products.Looking at acquisition for expanding it's current line of businesses in the following niche segments :Organic FoodsCompanies for meat free products (using pure vegetarian ingredients| products made from Tofu| Soy Milk)Non Dairy Drinks.This requirement is only in Europe. (Focus on France| Germany| Belgium and exclude UK)Interested in only 100% stake. Might consider majority stake as well if the business suits.,,2
9542,The company is a leader in innovative memory and storage solutions that transform how the world uses information| delivering systems for a broad range of applications.Looking to acquire companies globally| within the same sector and business lines: semiconductor industry| memory and data storage| IOT| embedded memory devices| machine learning| artificial intelligence| big data and analytics| security hardware| automotive memory solutions| hardware systems designs.,,2
9541,We are looking for businesses in the Automotive industry. Looking for - Chassis and modules| engines| exhaust systems| E-mobility| structural components etc.,,2
9539,We are interested in Western European companies which are related to Heavy-duty| Automobile and Interior sector of Coating business.Business areas:-Automobile components BUILDING MATERIALS- Celling Materials| Insulation Materials| Gypsum Board| Flooring MaterialsWINDOW PROFILES- Window Profiles| Balcony Window Profiles|System Window Profiles| Sense DoorINTERIOR DECORATIVE MATERIALS- Flooring Materials| Laminate FilmGLASS- Float Glass| Functional Glass| Automotive GlassCOATINGS- Decorative Coatings| Automotive Coatings| Marine Coatings| Plant Coatings| Industrial CoatingsADVANCED MATERIALS- Organic Materials| Inorganic Materials(AM| DCB)SILICONE- Silane| silane Coupling Agents| Fluids| Modified Fluids| Cosmetics| Antifoams| Textile Treating Agents| Architectural Sealants| PSA (Pressure Sensitive Adhesives)| HTV (High Temperature Vulcanisation)| RTV (Room Temperature Vulcanization)| LSR (Liquid Silicone Rubber),,2
9538,Looking to acquire mature| cash generative tech businesses and to hold them in perpetuity| re-investing cash flow in acquisitions or distributing it to the Company’s shareholders. mainly interested in web based businesses.,,2
9537,Fast growing media and technology group that specialises in business & consumer media| discount programmes and business software. Its strategy is to acquire mature| cash generative businesses and to hold them in perpetuity| re-investing cash flow in acquisitions or distributing it to the Company’s shareholders. We intend to remain private and has no “exit” strategy.  We can provide management and in other industries we back existing management to take the business forward.,,2
9534,Leading geothermal company and  recovered energy generation| with the objective of becoming a leading global provider of renewable energy is looking to acquire geothermal power plants and companies globally. It is also interested in companies that design| manufacture and sell power generating equipment as well as complete power plants on a turnkey basis.,,2
9533,This is a global market research company based out of US. It provides market information| tracking| analytic| and advisory services.The company focuses on 20 different industries under general merchandising namely| apparel| appliances| automotive| beauty| consumer electronics| diamonds| e-commerce| entertainment| fashion accessories| food consumption| foodservice| footwear| home| mobile| office supplies| retail| sports| technology| toys| video games| and watches / jewellery.Looking at strategic investments for organic growth as well as geographic expansion| in companies that are into :1)Syndicated Research 2)Point of Sale servicesNot interested in companies with the FMCG market as focus.,,2
9532,Our strategy is to acquire mature| cash generative businesses and to hold them in perpetuity| re-investing cash flow in acquisitions or distributing it to the Company’s shareholders.,,2
9530,An online marketplace looking for acquisitions as it looks to expand its presence in health and beauty.,,2
9528,This is a bank holding company based out of US. It is looking to acquire community banks in South West Florida.,,2
9527,Located in US| this is a manufacturing company that specializes in the fast growing printed electronics field. Looking for add on acquisitions; targeted business : Manufacturers of printed electronics products| membrane switches and printed interface electronic productsThe company is a custom designer and manufacturer of printed electronics| membrane switches| and interface technologies sold to leading OEM’s in the medical| appliance| gasoline dispensing| high-end industrial controls| instrumentation| and consumer electronics markets.,,2
9525,Looking for companies across the E-commerce value chain in SE Asia. We are flexible regarding the size of the targets.,,2
9520,US based| this company is the world’s premier provider of secure solutions – including global transportation and storage for high-value goods| currency and coin processing| smart safes| ATM services| security services and advanced technology.Looking to acquire businesses into cash logistics and in secure transportation and handling of currency and valuables throughout the logistics supply chain.Armored transport for bank deposits and change funds to ATM cash replenishments and coin delivery.,,2
9517,UK based logistics and transportation company| looking to acquire profitable businesses within the sector| focused on value added services like: Secure warehousing| HMRC customs bond|Quality control|Pressing services|RFID/security tag attachment|Label printing|Store recalls|Metal detection|Container de-stuffing|New store builds|Pick & pack services| Returns Management| Secure destruction facilities|Specialist storage facilities e.g. cigar humidors.Focus on companies that provide services to e-commerce businesses| e-fullfilment| multichannel solutions. Open to long term contracts| good quality of managementNot interested in regular transportation and logistics companies.The company caters to the following businesses : High-value fashion| Tobacco| Luxury goods| Alcohol| Gift vouchers. The company also provides an in-house software with back office support to enable online businesses exploit new opportunities.,,2
9516,As an experienced investor in the software industry (+300 transactions) we aim to expand our presence in the financial services sector. We already have a business in the sector (e.g. Wellington IT) and would like to grow the vertical further with acquisitions in North America| Europe| Australia or Japan. We would like to acquire established and mission-critical software companies with existing client relationships to customers in financial services industries and that have a significant part of their revenues recurring such as maintenance & support. We are not interested in resellers or pure integrators but rather look for companies who developed their own solutions.Especially interested in - Insurance| Benefits/pension admin| Financial services and Credit unionsOnly looking for software companies with their own IP| NOT interested in re-sellers.,,2
9514,Headquartered in Europe| the company operates in the areas of food| agriculture| energy and machinery. It's food sector is divided into two businesses - grain based products and bakery products.It is looking at acquisitions in USA and Europe for it's Bakery Products division. Focus is on frozen bakery/bread products| vis a vis fresh bakery products| e.g.: BagelsBaguettes|Buns|Ciabatta|Foccacia|Glutenfree|Panini|Pretzels|Raw Dough|Rolls|Rye Bread|Sandwich Products|Speciality Bread|Stone baked bread|Variety Packs.,,2
9510,Industries: industrial flow| valves| pumps| specialty materials| oil services; wastewater| water treatmentSize: $2MM up to $100MMIt has solutions to convert wasted pressure energy into a reusable asset and preserve or eliminate pumping technology in hostile processing environments. Its segments:Water Segment- products sold for use in reverse osmosis water desalination. Oil & Gas Segment- products sold for use in hydraulic fracturing| gas processing| and chemical processing. The Company-  offers hydraulic fracturing system.,,2
9505,Looking for Health care companies with a focus on administering and servicing value-based payments in insurance space. Core capabilities required :--Price identification for insurance product bundles-Data collection and analysis of claims history-Patient / Member risk identification and stratification-Provider payment reconciliations-Ability to integrate into insurance carriers’ claims adjudication system,,2
9502,Looking for event management companies with primary focus is large-scale business-to-business events.,,2
9501,Looking for businesses that provide customers with solutions and decision tools to assist them in evaluating and predicting risk and enhancing operational efficiency like auto insurance companies with better risk assessment so they can offer their customers lower prices and enable healthcare providers to keep down medical costs.,,2
9500,We are looking for companies that provide information and analytics that help institutions and professionals progress science| advance healthcare and improve performance. Also| help researchers make new discoveries| governments and universities evaluate research strategies| physicians to find the right clinical answers etc.,,2
9499,We are looking for companies that help lawyers| regulators and businesses with legal data| analytical support and tools that help in increasing productivity.,,2
9497,We are interested in acquisitions of businesses providing specialty rental equipment to the T&D (Transmission and Distribution)| rail| communications| lighting and sign industries. We operate across the US| Canada and recently we entered Mexico. Heavy duty equipment like - aerial devices| back easement digger tracks| boom trucks and cranes| digger derricks| pressure drills/diggers| stringing gear| trailers| repair parts| tracks| and specialty equipment for various industries| including transmission| distribution| telecommunications| foundation| rail| sign| wind| utility construction| underground| and others. Not looking at dealers| only interested in rental businesses.,,2
9494,We are looking for companies with activities in agriculture & fisheries industries. Our key segments are:- -Marine Products Manufacturing-Palm Oil-Integrated Livestock Farming,,2
9492,We are looking for companies that thermoplastic material based semi-finished or finished products used in machine parts|  industrials| medical equipment (implants)| moulidng etc. We are not interested in tier 1 automotive parts due to customer conflicts.,,2
9491,The company is a leading provider of total plant lifecycle solutions for the power| process and industrial markets.Our engineering| construction| maintenance group has traditionally been focused on the nuclear and fossil (power) markets but has an interest in expanding its process & industrial foothold particularly in the areas of food & beverage| advanced manufacturing| oil & gas| and chemicals. Looking at companies that are into  maintenance and modification which is the company's core competency ; focused on expanding in the areas of capital projects work as well.,,2
9489,Looking to make an acquisition in the government services market to include security services| architecture & engineering| facility-related services| and professional services.The services could include security services| both armed and unarmed and facility related services like design and maintenance.Most interested in companies with the US federal government as the primary client.,,2
9488,We are focused on on developing and acquiring technologies that help pharmaceutical companies discover and develop medicines. The Company is involved in the development and licensing of biopharmaceutical assets. We are looking for companies or assets that are royalty bearing and have their own IP and patents. Open from Pre-clinical drugs as well.,,2
9487,We are a value-added reseller of third party business applications; we publish a suite of our own proprietary software solutions; and we are a managed services provider of our clients' networks| providing 24/7/365 remote network monitoring| hosting| business continuity| cloud| email and web services.Managed services providers- MSPs provide SME clients with a suite of services| which may include 24/7/365 remote monitoring of networks| disaster recovery| business continuity| data back-up| cyber-security and the like.  Value added re-seller- we are looking for value-added reseller for a number of industry leading Enterprise Resource Management (ERP) and accounting software applicationsIndependent Software Vendor-ISVs are publishers of both stand-alone software solutions and integrations that integrate with other third party products.  Our interest lies with ISVs selling into the small and medium-sized business marketplace| providing applications addressing e-commerce| mobility| security| and other functionalities.Not interested in reselling hardware.,,2
9486,These are not strict| but gives a general idea of what we are looking for.Company Revenue $3-$30MEBITDA: $1-$10MRegions: U.S. / Canada / EuropeLooking for products and services with below application in : quality assurance| quality control| inspection| testing| measurement| analytical instrumentation| calibration| gas flow| diagnostic| microbiology| electronic device| sensing| laboratory analysisIndustries: Healthcare| Life Sciences| Manufacturing| FoodMarkets: medical device manufacturing; research; pharmaceutical/biopharma manufacturing; food/beverage processing| packaging bottling; cleanroom| industrial hygiene; environmental monitoring; dialysis; cold chain packaging/monitoring; sterility assurance,,2
9482,The acquisition criteria for our two acquisitive divisions are as follows:Banking division•	Sector: Specialist lending•	Operating in a niche market i.e. we are not interested in commoditised areas of lending e.g. mortgages•	High margin •	Up to c.£100m acquisition price•	UK focused (no international presence)Wealth management division•	IFAs/DFMs/ Networks•	Over £300m AuA•	Average client size over £250k•	UK focused (no international presence),,2
9480,The company provides high-performance fluid sealing and pipeline solutions with an emphasis on safety| longevity| and productivityLooking at acquiring businesses| that provide the following products and sealing solutions for the mentioned industries:Hygienic Products (Food/Beverage and pharmaceutical production equipment)Pipeline products (oil and gas pipelines)Industrial sealing solutions,,2
