id,udes,ades,ds
9895,Headquartered in the United States| this is a globally diversified information and financial services group. The firm acquires companies that have potential with an aim of setting up their global operations and making them profitable.Acquisition CriteriaThe firm is seeking Global opportunities with the below mentioned specifics:Data centre and integration services with minimum revenues of USD 30 mn. The firm does not have any restriction on geography but will invest only in democratic countries.,NULL,2
9894,Headquartered in the United States| this is a globally diversified information and financial services group. The firm acquires companies that have potential with an aim of setting up their global operations and making them profitable.Acquisition CriteriaThe firm is seeking Global opportunities with the below mentioned specifics:1) Debt collection services -The target should have minimum revenues of USD 20 mn if its based outside North America| minimum revenues of USD 10 mn if it's within USA and Canada2) Tender Information Services - Global - Minimum revenues of USD 5m+3) E- tendering solutions - Global - Minimum revenues of USD 10mn+The Preference is to acquire one of the regional Market Leaders| in any democratic region.,NULL,2
9893,Headquartered in the United States| this is a globally diversified information and financial services group. The firm acquires companies that have potential with an aim of setting up their global operations and making them profitable.Acquisition CriteriaThe firm is seeking opportunities in Europe| Asia and Australasia in the nice software space| with the below mentioned specifics:HR & Payroll Software Solution -    Revenue $5mn+ERP| CRM Software Solutions -       Revenue $10mn+Workflow management solutions - Revenue $10mn+Clinic Management Software -        Revenue $15mnIt can also consider any other niche space/product| wherein the business is generating an EBITDA of at least $1mn,NULL,2
9884,Based out of Canada| this is a leading specialty CRO providing clinical laboratory testing services in immune monitoring and proteomics to the biopharmaceutical industry.Acquisition CriteriaThe company is seeking opportunities to diversify and expand its current business by acquiring companies offering complementary laboratory services primarily focused on clinical testing as well as analytical services for biologics manufacturing process development and characterization:1) Complementary Clinical Immunology and Biomarker Offerings:Diversify current immune monitoring offering by adding complementary technologies that support analytical services for vaccines (human/animal)| immuno-oncology| auto-immune| infectious diseases| metabolic and CNS diseases. Services could include but are not limited to immunogenicity| serology| systems biology| and complementary omics (e.g. genomics| metabolomics and lipidomics)2) Biologics Manufacturing:Comprehensive suite of assays for the characterization of pre-clinical through to commercial stage biologics/biosimilars. Services of interest include immunogenicity| physicochemical characterization| stability and other bioanalytical methods supporting preclinical to commercial biologic manufacturing3) Other servicesGrow current services in biostatistics| bioinformatics| clinical data analysis and reporting,NULL,2
9881,Headquartered in the United States| this company  manufactures and distributes metal formed products and class-C components. The company offers fasteners and cold formed components| cold forged components| internally threaded components| pierce and clinch fastening systems| CNC wires and tubes etc.It provides products and solutions for several industry segments| including automotive (OEM-direct and tier)| aerospace| defense| medical| lawn and garden| appliance| elevator| HVAC| energy| heavy equipment| and others.The company is currently seeking opportunities in the below mentioned areas:Manufacturers of:Cold formed fasteners and other componentsMachined partsPlastic componentsRoll formed partsStamped partsWire formsSpringsRubber partsCastings/ForgingsPowder metal parts and other specialty niche componentsDistributors of:Fastners and Classic C itemsAerospace components,NULL,2
9875,Global supplier in the design| manufacture and service of slurry pumps| parts and associated products. We are looking for companies that provide slurry pump or other mining  equipment globally.,NULL,2
9874,We are looking to acquire insurance brokers that specialize in property and casualty.,NULL,2
9868,Looking for professional footwear companies with no seasonality like safety shoes or other working shoes with professional specification and dependency on changing fashion.,NULL,2
9866,We are seeking acquisition of event management companies especially-  trade shows and conferences.,NULL,2
9864,We are looking for distributors and manufacturers of print circuits for electronic systems. Only distributors in case of North America and Europe.,NULL,2
9858,We are looking for health care products and services companies in dental| animal health and helping medical practitioners.,NULL,2
9857,We are looking for health care products and services companies globally in dental| animal health and helping medical practitioners. We are mainly looking at healthcare products distributors| healthcare software| practice management etc.,NULL,2
9856,We are mainly looking at healthcare products distributors| healthcare software| practice management etc.,NULL,2
9855,Leading specialty CRO providing clinical laboratory testing services in immune monitoring.  It is seeking to diversify and expand its current business by acquiring companies offering complementary laboratory services primarily focused on clinical testing as well as analytical services for biologics manufacturing process development and characterization.Complementary Clinical Immunology and Biomarker Offerings:Diversify current immune monitoring offering by adding complementary technologies that support analytical services for vaccines (human/animal)| immuno-oncology| auto-immune| infectious diseases| metabolic and CNS diseases. Services could include but are not limited to immunogenicity| serology| systems biology| and complementary omics (e.g. genomics| metabolomics and lipidomics).Biologics Manufacturing: Expand on current MS-based host cell protein and pharmacokinetic analytical offerings to provide a more comprehensive suite of assays for the characterization of pre-clinical through to commercial stage biologics/biosimilars. Services of interest include immunogenicity| physicochemical characterization| stability and other bioanalytical methods supporting preclinical to commercial biologic manufacturing.Other services: Grow current services in biostatistics| bioinformatics| clinical data analysis and reporting.,NULL,2
9854,We are seeking tier 1  automotive suppliers that are supplying components directly to the original equipment manufacturer (OEM).,NULL,2
9852,We are looking for pharma companies or drugs for acquisition. Not looking for too early stage opportunities. Prefer mid clinical stage drug development opportunities. Flexible regarding the specialties. However| prefer - metabolic| cardiovascular| ophthalmology| oncology| antibiotics etc.,NULL,2
9839,Interested primarily in acquiring natural gas suppliers/marketers as well as energy services companies.Not interested in Oil related companies.,NULL,2
9838,Headquartered in Europe| this company provides cloud services for various businesses in Italy and internationally. It offers hybrid| hosted private| and public cloud services; cloud services for critical applications; business continuity and disaster recovery services; cyber security services; technology migration programs; digital business transformation services; and services desk and desktop management solutions. RequirementThe target company should provide services as: Private or Hybrid Cloud| Public Cloud| Infrastructure as a Service| or| Hosting| or SAP Hosting| SAP Cloud. SAP Hana Cloud| Housing/Colocation.,NULL,2
9828,Headquartered in NA| the company is a global leader in the design and implementation of coalition loyalty programs| customer analytics and loyalty services for companies across different sectors.RequirementCurrently it is looking to acquire companies to compliment/facilitate its existing services:Retail AnalyticsCategory ManagementPricing and Promotions - Programs and activitiesLoyalty Programs and StrategyCustomer Centric Analytics,NULL,2
9826,Headquartered in Asia| this group has business interests in Asia| Africa and a few regions of Europe. It has a vast portfolio that covers various sectors like consumer goods| food| energy| financial services etc.RequirementFor it's current acquisition requirement| the company is looking at manufactures and distributors for food and consumer products:- Consumer goods distribution companies- Companies involved in local manufacturing and distribution- Retailers (Not a priority),NULL,2
9825,With it's headquarters in Asia| this company is a global leader in the housing and building industry and owns well known brands that are into designing| manufacturing smart tech sanitary wares.RequirementThis current requirement is to acquire manufacturers of ceramics/ ceramic ware that finds application in bathroom and kitchen ware. For instance washbasins| toilets etc. Manufacturers of tiles/tableware to be excluded.The prefered EBITDA margin is a min of 10% for these acquisitions.,NULL,2
9824,Headquartered in Asia| this company is a global leader in the sanitary ware industry with a multi-brand| multi-category| multi-channel sales platform across different regions.It has well established global brands that are known for quality and innovation.RequirementThe company is looking at acquisition targets within the same space| i.e companies that provide sanitary ware designs and technologies that help in reduction of water consumption as well as aim at improving the consumers' lives| health and comfort.This water technology finds application in water flow management| smart water applications| smart filtration taps/applications etc.The preferred EBITDA margin is a min of 6%.,NULL,2
9823,Headquartered in Europe| this is a global player in the oil and energy industry with footprints in almost 140 countries. RequirementThe current requirement is to target acquisitions in Brazil| within the same space :Exploration & Production| Upstream| Midstream| Refining| Trading| Shipping| Marketing| Energy| Crude Oil| Petroleum| Petrochemicals| Renewable Energy etc.Other requirements include developing terminals like energy terminals| gas capacity terminals| oil distribution etc.,NULL,2
9821,Headquartered in Europe| the company is one of the leading brands in the speciality chemicals market| and leader in market segments including coatings| construction| technical textiles| paper and synthetic latex gloves.RequirementThe company is looking at bolt on acquisitions| targeting businesses in the same space: manufacturers and suppliers of specialty chemicals; Acrylic and Vinyl emulsions polymers| speciality polymers and Styrene-Butadiene and Acrylonitrile-Butadiene latex etc. These find use in the following industries/products: 1)construction and coatings 2)paint and lacquer3)Construction chemistry4)Construction adhesives,NULL,2
9818,Headquartered in USA| this company provides recreational facilities and services with a focus on adventure lifestyle.RequirementThe company is looking to acquire other companies in operating in the same domain that provide facilities and services for leisure| travel and outdoor activities. This could include different types of resorts like mountain resorts| companies that set up camping tours| destination management company| travel retail and wholesale and tour operating companies.,NULL,2
9814,Based out of North America| this is a design| engineering| construction and maintenance service company. It offers a full-service suite of offerings : underground construction| aerial construction| inventory management and technical services including fibre splicing and testing.RequirementCompany is interested in companies providing the following four core areas of service in the telecom| power transmission| municipal and engineering space:1) UNDERGROUND CONSTRUCTION - Directional Drilling| Hydro Excavation| Traditional Open Trench Installation| Manhole Rebuilds & New Installation Vaults| Chambers & Handwell Installation| Existing Structure Blockage Repair and Placing of Cables 2) AERIAL CONSTRUCTION - Pole Installation & Removals: Place New Strand| Lash & OverLash Cables| Place Anchors & Down-Guys| 3rd Party Pole Changes & Forced Moves and Cable Removal & Scrapping  3) TECHNICAL SERVICES - Fibre for Multiple Dwelling Units (Fibre to the Building: FTTB & Fibre to the Suite: FTTS)| Provide Full Technical Design| Lay Out and Upgrading| Segmentation & Node Splitting| Fiber Splicing & Testing4) ENGINEERING SERVICES – Civil & IndustrialGeography -All provinces in Canada with the exception of Quebec; Manitoba and BC markets will be preferred; US : Texas (San Antonio| Houston| and Dallas/Ft Worth)| California (Irvine area)| Boston and New York.,NULL,2
9813,Looking for companies in production and distribution of hinges| locks and fastenings for doors as well as tempered glass panels for internal and external applications globally.,NULL,2
9812,Headquartered in Europe| this is a global pharmaceutical company that works towards aiding patients who are suffering with severe diseases. RequirementThe company is looking at partnering or acquiring technology solutions in the pharmaceutical and biotech spaces. It is interested in companies that would provide technology solutions to help the patients suffering from neurological diseases like " Epilepsy" or "Parkinson's disease". These solutions could be in the form of a device/ platform/analytics etc that either help in the diagnosis or cure of the mentioned diseases or in the discovery and development of new medicines.,NULL,2
9811,This Korea based semiconductor company designs and manufactures analog and mixed-signal semiconductor products. It's products are mainly used for high volume consumer applications.RequirementThe company is looking to acquire similar semiconductor companies that design and manufacture mixed signal and analog semiconductor platform solutions. It is interested in products that find application for communications| Internet of Things (“IoT”) applications| consumer| industrial and automotive applications. 1) Display Solutions : For major suppliers of large and small rigid and flexible panel displays|mobile| automotive applications and home appliances2) Power Solutions : For power management in communications| consumer and industrial applications3) Mixed Signal Services and Technology : Including power| high-voltage| non-volatile memory and Radio Frequency (“RF”) for Integrated Device Manufacturer (“IDM”) semiconductor companies that primarily serve communications| IoT| consumer| industrial and automotive applications,NULL,2
9810,Europe based conglomerate| with over 120 group companies| is looking to invest up to SEK 3 billion over the next 18 months. It has 3 different business areas : distribution of dental products| manufacturing of demolition robots and attachments for excavators and cranes and systems solutions provider.RequirementThe company is looking to acquire companies both in the distribution and the manufacturing space. It is interested in the following tools and equipments :-Dental materials and equipment-Demolition robots and attachments for excavators and cranes-Interiors for Vehicles-Construction Materials like electrical supplies-Contract Manufacturing-Environmental Technology-Sawmill EquipmentThe companies should also have the following characteristics:ROCE >50%EBITA margin above 15%Stable operationsLeader in its market nicheAn attractive position in the value chain with independence from single suppliers or customersNo or limited exposure to technology risks,NULL,2
9809,We are looking for companies in optical transceivers| silicon photonics and other related optical subsystems. That offers optical interconnect solutions like optical fiber cable for customers in the field of cloud computing| data centers| data communication| long-distance transmission| and wireless access.,NULL,2
9808,Headquartered in the United States| this company works in the space of medical technology| devices| biomedical engineering to provide facilities/services| appliances that improve human health in terms of alleviating pain| restoring health etc.RequirementThe current requirement is to acquire companies in the healthcare tools and services sector that provide services and therapies for cardiac issues| pain management| spinal ailments| diabetes| surgery| brain related issues etc.It can also consider diagnostic centres that treat minor cardiovascular diseases or help patients in diabetes management.The company is also interested in healthcare technology platforms that are service oriented.Preferred EBITDA margin : 25%,NULL,2
9806,China based| this is a talent solutions provider that provides multiple recruitment services for mid to senior level positions| technical positions and temporary or permanent staffing requirements.RequirementIt is looking at acquisitions in USA| Europe and South East Asian countries within the same spectrum.- Recruitment process outsourcing (RPO)- Permanent Staffing- Temporary Staffing- Talent Acquisition Consulting Services- Recruitment Training- Campus Recruitment and Employer Branding,,2
9805,Headquartered in the United States| this is one of the leading contract research organisations that provides consulting on the biopharmaceutical product from discovery through post approval. It's clients and partners include pharmaceutical| biotechnology| medical device| academic and government organisations.RequirementThe company is looking to acquire CROs in the United States that operate in the following domains :integrated drug development| laboratory and lifecycle management services| clinical development services to help in advanced drug research| full service CROs for Biotech companies| laboratory services.,,2
9802,Headquartered in USA| this is one of the largest companies operating in the beauty sector and has a global presence. It manufactures beauty products like fragrances| colour cosmetics and skin and body care products. RequirementThe company is looking to acquire other beauty and personal care products companies| on a global level with a focus on Fragrances|Cosmetics| Skin care| Hair care (salon hair colour and styling products) etc.,,2
9801,With it's headquarters in Europe| the company is a focussed building supplies and functions in heating technology| air-conditioning/ventilation technology| sanitary equipment| windows and external doors| profile systems and interior doors.RequirementIt is currently targeting companies in the same sector based out of Eastern or Central Europe that have the following business:1) Building technology - Heating Technology| Air-Conditioning and Ventilation Technology for residential| commercial and public buildings2)Doors- (steel and stainless steel profile systems for doors| windows and facades| used in fire and smoke protection as well as intruder- bullet-resistant system)3)Windows- (customised window systems made of wood| vinyl|aluminium as well as ventilation and shade solutions),,2
9800,Leading Travel service provider is looking to acquire majority stake in•	Tour Operating•	Travel retailing•	Travel wholesaling•	Destination Management Company•	Travel Technology•	Online marketing,,2
9798,Headquartered in the United States| this company is one of the major players in the e-mail security solutions space. It provides efficient and user friendly solutions for cyber security including data loss prevention| e-mail encryption etc.RequirementThe company is looking to acquire similar security software players in the cyber security space| that provide solutions like data loss prevention| threat protect| e-mail archiving| e-mail encryption and bring your own device mobile security. The industries in focus are primarily healthcare and finance.,,2
9797,With it's headquarters in Europe| the company is one of the global leaders in the specialty chemicals industry. It majorly caters to the following different segments : Nutrition and healthcare| resource efficiency| materials.RequirementIt has a global acquisition requirement in the specialty chemicals sector| with focus on:1) Nutrition & Care - For use in consumer goods for daily needs| and in animal nutrition and healthcare products2) Materials for environment-friendly and energy-efficient systems to the automotive| paints| coatings| adhesives3) Polymer materials and intermediates| mainly for the rubber| plastics and agriculture industries.4) Specialty additives used in car paints| among other applications.5) Adhesives and cross- linkers6) Silicas - Consumer goods ( used in toothpaste)Some of the industries in focus are - Adhesives & Sealants| agriculture| automotive| composites| Construction| food| medical technology| oil & gas| Pharma| pain and coatings| solar power etc.,,2
9796,Headquartered in Singapore| the company is a provider of customised solutions? in the telecommerce and teleconsulting industries. It aids multinational companies with highly efficient outsourced contact center services that help in customer retention and results in accelerated sales for the company.RequirementThe company is looking to acquire similar businesses in the offshore/ outsourced contact centre services segment in Asia| Latin America and that provide the following:- Recruitment and selection- Training and development- Coaching - Quality Assurance,,2
9795,Based out of Singapore| the company is into insurance and reinsurance for both mid to large sized corporates as well as public sector organisations.RequirementIt is focused on acquiring non life insurers with a large share of corporate insurance business (ie Marine| Aviation| Credit & Surety| Property| Casualty| Energy). Personal lines (Motor| PA/TA business) should be a relatively small share of the total book.,,2
9794,Based out of South Africa| this company provides retail solutions on an international level. Over the last many years| it has provided value to many huge brands by acting like a middleman between the retailer and the manufacturer| ensuring efficient in store merchandising| stock management| customer engagement and accurate data insights.RequirementIt is looking to acquire similar companies in the field of retail solutions| namely in the following categories:1)Field sales and retail execution : Stock management| Merchandising| Sales force| Point of purchase execution including measurement of key performance indicators in stores2)Facilitating Brand Activation : Brand building activations| Brand ambassador programs| Informal trade activations| Mystery shopper audits| In-store retailer programsPoint of sale management including distribution & installation3)Information Technology - Digital Tech companies : Providing market intelligence and data on pricing| availability| share of shelf and promotional effectiveness into a catalyst for innovation and transformation.Investment amount will be capped at USD 20 Mn for India and China and USD 30 Mn for Europe.,,2
9793,We are looking for specialty chemical companies that servicing to the industrial market. We are not interested in pharma and F&B oriented players. We are interested in high margin companies with applications in painting| coating| adhesive| carbon fibers| auto agrochemicals| O&G| Lubricants etc.,,2
9792,Based out of Australia| this company is one of the major providers of healthcare facilities and services| especially to people with disabilities. The company is primarily looking at acquisitions within the same sector| as described below:Requirement:It is mainly interested in the following business categories:Medical productsMobility devicesPersonal care products & services (disinfectants and cleaners| nutrition| skin care| syringes and needles)Products and services relevant to the aged care| disability and health care sectorsTraining businesses,,2
9789,Headquartered in the United States| the company provides end to end solutions and services for the pharmaceutical industry. This is facilitated by a full service CRO and data analytics services.RequirementIt is currently Looking for US based CROs preferably drawing major revenues from NA. The preferred company profile is as follows -1)At least 2-3 large pharma co accounts of >$10 mn order value each2)At least 15-20 mid pharmaco accounts of >$5mn each order value3)Excellent delivery record of >3 yrs and revenue visibility for the next 4)Repeat order. Client continuity in all Phases of trial5) Technology-backed delivery| leveraging advanced e-Clinical systems (i.e.| CTMS| EDC| analytical solutions like RBM- Risk based monitoring for clinical trials etc)| having own IP is an added advantage.6)Bio Similar capabilities,,2
