id,udes,ades,ds
9788,This company is a multi-discipline firm specializing in environmental| facilities| geotechnical| and materials services. It has more than 140 offices on a global level and is looking at acquisitions mainly for geographical expansions and to compliment its existing businesses.RequirementIt is currently targeting companies that are operating in either of the mentioned business areas - environmental| facilities| geotechnical and materials services.- Environmental services : Brownfields and Site Redevelopment| Environmental Management Systems| Environmental Site Assessments and Investigations| Industrial Hygiene and Occupational Safety| Natural Resources and NEPA Services| Solid Waste Planning and Design- Geotechnical Consulting Services : From drilling soil borings| running laboratory tests and delivering a report within a reasonable time frame : Expected Conditions| Subsurface Exploration| Laboratory Testing| Instrumentation|Construction Monitoring & Support- Materials Services : For construction materials inspections with state-of-the-art construction materials testing laboratories; Construction Quality Control and Quality Assurance Programs| Design and Review of Concrete| Grout| and Asphaltic Concrete MixesDiagnostic Investigation and Evaluation of In-place Materials| Diving Services| Field and Laboratory Testing and Analysis| On-site Observation and Monitoring- Facilities : Facility engineering including building enclosure condition assessments| MEP (mechanical| electrical and plumbing) consulting| engineering diagnostics| Property Condition Assessments/Facility Condition Assessments| Building Enclosure Consulting (Roofs| Walls| and Waterproofing),,2
9785,Headquartered in USA| the company is one of the leaders in providing management consulting| technology and engineering services to corporates| non profits and government organisations.RequirementThe company is looking at acquisitions in the fields of consulting| analytics| digital solutions| engineering and cyber solutions with a strong focus on the US markets. It is focused on capability plays of scale around software  development| engineering| NextG analytics and cyber in commercial/international and federal market opportunities:1)Consulting Services: For strategy development| organizational design| efficiency| transformation| strategic communications and human capital2)Analytics: Decision analytics (including operations research and cost estimation)| intelligence analysis (including all source analysis)|data science and machine intelligence.3)Digital Solutions: Development| designing and implementation of software development services| advanced analytics| cloud| and internet-of-things strategies.4)Cyber: Cyber risk management| cyber security 5)Engineering: Like network services and communications| data center operations| and data storage| reverse engineering| systems engineering and applications etc.The focus is on government markets with an opportunistic interest in relevant commercial opportunities as well.,,2
9784,We are looking for pet care products company in the US especialy for cats| dogs and all the small furry animals likes rabbits| guinea pigs| hamsters etc. We are looking for consumables manufacturing but not specifically in food. We focus on litter and bedding.,,2
9783,Headquartered in Europe| the company is an electrical components manufacturer with a focus on low voltage switchgear sector. It is involved in the business of designing| manufacturing as well as in selling electromechanical switch gear| used for both private and public distribution.RequirementThe company is looking to acquire similar businesses with a huge focus on the US markets. The companies could be involved in designing| manufacturing and marketing of:1)Products for the low voltage switchgear sector2)Solutions for disconnection and protection in low voltage applications3)Plastics Injection Moulding (thermosetting polymers and thermoplastic materials)4)Switch plug components for do-it-yourself - no volt coils| single parts and switch plug combinations| brake switches and controls| push button switches| motor protection switches| customised cam switches and DC switches etc.,,2
9776,This company is headquartered in the Middle East and provides cloud based solutions and services to various businesses. The company focuses on business management software solutions including ERP and CRM and assist businesses with their IT operational challenges.RequirementThe current requirement is to acquire companies / enter into partnerships in the same domain| to increase its market share and profitability. It is interested in companies that provide cloud productivity|  CRM solutions and ERP solutions that benefit domains like HR & Payroll| Finance| Electronic Document Management| Customer Relationships| Service Management etc. Target industries range from oil and gas| to healthcare| logistics| manufacturing| and education etc.,,2
9775,We look at Business process management asset in Healthcare insurance segment (capabilities in care management| payment integrity| analytics)| omni channel and digital engagement technology / capabilities for our Customer care business and efficiency improvement technologies / capabilities across businesses (machine learning| RPA| AI| analytics).,,2
9773,Based out of Middle East| this is a technology and services company operating in the Oil and Gas industry. Currently| the company provides the following services - Specialty Oil & Gas Field Services| Industrial/Power Boiler Services| Thermal Engineering Services| Mechanical Equipment & Specialty Chemicals Trading| General Plant Maintenance Contracting| focused on Re-Tubing & Rotating Equipment.RequirementIt is looking to acquire companies in the oil gas and energy space that are in the upstream (exploration and production) or downstream (processing| selling and distribution) business. It is also interested in companies that provide Specialty Oil & Gas Field Services and Industrial/Power Boiler Services. Companies that have a technological advantage in this domain will be preferred.,,2
9771,Headquartered in Europe this is a leading transport and logistics company that operates in contract logistics| warehousing| LTL - less than load : transportation of small freight| FTL : full truck load transportation| sea and air freight etc.RequirementThe company is looking at acquisitions as per the below mentioned:1)Road transportation and logistics : dry and fresh goods transportation| transportation of frozen goods in controlled temperatures ( excluding meat products)2)Contract logistics solutions including warehousing| unloading| picking| securing shipments and preparation for distribution| as well as additional services including labelling| foiling or preparing promotional sets.3)Sea and Air transportation servicesRegional focus : Will prefer companies from the Eastern European region,,2
9769,Based out of Europe| the company provides software development| engineering and consultancy services with 3D and Product Lifecycle Solutions being the focus.RequirementThe company is currently looking to acquire similar innovative enterprise software companies working in domains like| PLM - Product Lifecycle Management| operation manufacturing| marketing| after sales services| machine data| IOT| configuration management software| simulation applications etc. The industries of interest are : aerospace| architecture engineering| energy| utilities| Lifesciences| financial and business services| Hitech| industrial equipment| marine| transportation and mobility| consumer goods and services.,,2
9767,We are looking at specialties in gastro| cardio| diabetics and ortho,,2
9766,European provider of building technologies solutions including operation| automation| comfort| fire safety and security. These products and services are focused at optimising energy costs| reliability and comfort of both public and commercial buildings.RequirementThe company is looking at acquisitions within the same space| namely:1)Manufacturers of components| products and systems for efficient control of heating| ventilation and air conditioning (HVAC) systems.2)Monitoring| maintenance| modernization and efficiency optimization services for buildings and infrastructures3)Total Building Solutions : Consulting| planning| development and financing for turnkey integrated automation| including  security and fire safety solutions4)Security solutions : Intelligent video surveillance| access control and identity management including control center technology5)Building automation : Automation and HVAC products aimed at minimalised installation and operating costs6)Fire Safety : High quality fire safety products for early and reliable detection deception-proof alarming| evacuation processes as well as intelligent extinguishing7) Energy Efficiency : Products and consulting services for efficient consumption of energy leading to lower costs,,2
9765,With its headquarters in Europe| the company is in the business of manufacturing and selling pressure sensitive adhesive tapes for industrials. The company excels in pressure sensitive technologies and serves industries like transportation| electronics| automotive| building supply| industrial| appliances| paper and print.RequirementIt is looking to acquire companies in the same business; namely manufacturers of adhesives and adhesive tapes for the above mentioned industries. Some application examples are : mounting| injection| component marking| surface protection| secure transport| Wire harnessing| surface protection| furniture| doors| windows| adhesive solutions for solar energy| adhesive tapes for wind energy| chip bonding and card attachment solutions for smart cards etc.Companies with an EBITDA margin of min 7% will be preferred.,,2
9764,Headquartered in United Kingdom| the company is one of the leading providers of information services. It excels in building and using consumer data for various services like credit solutions| marketing solutions| consumer marketing based on demographic split| credit reports etc. across multiple sectors.RequirementThe company is looking at acquisitions to expand it's current businesses. The target companies could be the ones that provide data analytics solutions and platforms such as credit decisioning platforms| fraud prevention platforms and consumer credit decisioning platforms. These platforms are majorly used by banks and financial institutions in order to detect fraudulent activities and credibility of a consumer| e.g. : fraud and ID Verification| banks and card checks| credit risk reporting and scoring| consulting and analytics.,,2
9762,Italy based| this company is a provider of digital and software solutions for the global financial services industry. It aims to leverage on the digitalisation in the wealth management| investment banking| asset management industries.RequirementThe company is looking to acquire other companies providing software solutions to the financial services industry to grow it's existing portfolio and also to compliment it in terms of providing solutions to core banking platforms| banks| private banks| brokers etc.,,2
9757,We are looking for signaling and solar lighting solutions for infrastructure| both on land and waterways. We are interested in - Signals for Airfield Ground Lighting| Aviation Obstruction| Offshore Wind | Marine and Traffic markets;   Illumination for solar powered LED outdoor lights for municipal and commercial customers and Power segment serves both On-Grid and Off-Grid verticals like solar panels.We are involved in the following verticals and seek businesses that complement or compete in these areas:Marine (aids to navigation products and systems for coast guards| marine authorities| navies| and ports around the globe).Traffic & School Signals (flashing beacons for pedestrian crosswalk signals| school zone flashers| and 24-hr roadway beacons).Telematics (remote asset tracking and monitoring).Illumination (LED lighting for pathways| parking lots and streets - municipal and commercial).Airfield Ground Lighting (marking of runway and helipads at military and civilian airports).Aviation Obstruction Lighting (marking of hazards to air traffic| barricade lighting| way-finding| and railway “blue flag” protection).Offshore Wind Lighting (comprehensive safety and marking systems for offshore wind farms).,,2
9755,We are looking for ATM owner/operator and other services providers.,,2
9754,Headquartered in Germany| the company is one of the leading manufacturers of wires| cables| optical fibres and related systems for various industries.RequirementIt is looking to acquire companies that manufacture wires| cables and related electronic products that find application in auto and commercial vehicles| industrial solutions| electrical appliances and wires| conductors and copper solutions.1) Companies producing cables for power and data transmission2) Wire Harness and cable assembly for the automotive industry3) Related electronic products : connectors and network components like routers and switches.The EBITDA margin of the target companies has to be a minimum of 10%.,,2
9753,Headquartered in Germany| the Company is a leading cleaning equipment manufacturer with the worldwide presence in 65 countries. In the year 2016| the revenue of the Company is USD2.7Bn and is looking for targets worldwide in cleaning products such as high pressure cleaner| vacuum cleaner| electrical sweepers| electrical polisher and others. Target Company would have revenue up-to USD500m and positive EBITDA margin.,Headquartered in Germany| the Company is a leading cleaning equipment manufacturer with the worldwide presence in 65 countries. In the year 2016| the revenue of the Company is USD2.7Bn and is looking for targets worldwide in cleaning products such as high pressure cleaner| vacuum cleaner| electrical sweepers| electrical polisher and others. Target Company would have revenue up-to USD500m and positive EBITDA margin.,2
9751,Headquartered in the United States| the company is a provider of information technology solutions and software services with a focus on innovation. Currently it's expertise is in Data Warehousing| Quality Assurance| Java| Applications| and Networking.RequirementIt's acquisition targets consist of companies that provide IT solutions and software services; saas| cloud| IoT| software development| customer e- commerce| vertical market software| companies that operate on the IaaS model ( Infrastructure as a Service model) and companies providing applications like real-time systems| online systems| embedded systems| process control| transaction processing| image processing| data communications| networking| parallel architectures| e-commerce technologies and database management.The immediate requirement is in India| but can consider companies in USA as a secondary option.,,2
9750,We are looking for branded toy and entertainment companies that design| develop| manufacture| and market consumer products for children.Not looking at retailers.,,2
9748,Headquartered in the United States| the company is one of the leading providers of services and products (chemicals| equipments etc) to laboratories. It caters to the following customer base : pharmaceutical companies| biotechnology firms| industrial applications| education sector ( research scientists in academia)| government sector and healthcare industries.RequirementIt is currently looking at acquisitions in the below mentioned categories| with a min EBITDA margin of 15% :1) Manufacturers of Pharma and API products that are used as ingredients for making the drug2) Manufacturers of consumables ( disposable pipettes| beakers| disposable gloves| facemasks| test tubes etc.) and equipments that are used in manufacturing bio Pharma products. These products should preferably be of single use in nature.3) Clinical trial services - Suppliers of products and services used for clinical trials ; logistic services| storage facilities. (Commonly clinical trials evaluate new pharma products| medical devices (such as a new catheter)| biologics| psychological therapies| or other interventions).,,2
9747,Headquartered in the United States| the company is one of the leading providers of services and products (chemicals| equipments etc) to laboratories. It caters to the following customer base : pharmaceutical companies| biotechnology firms| industrial applications| education sector| government sector and healthcare industries.RequirementIt is currently looking to acquire companies/ distributors of laboratory chemicals| equipments and consumables ( pipettes| beakers| funnels| test tubes| autoclave accessories etc)  in the US and Europe markets. These companies should have a minimum EBITDA margin of 7%.,,2
9746,Headquartered in Germany| this company is a prominent player in the Food and Beverages sector with a special focus on confectionary products made by fruit processing. Some of the products include fruit purees| jams| fruit bars etc.RequirementThe company is looking to acquire primarily other F&B companies that are into fruit processing/ fruit preparations in the United States of America. It is also interested in businesses which would complement the fruit preparation business. For instance| confectionary businesses| flavour houses| companies involved in the production and processing of nuts| cereals| chocolate coated nuts etc.,,2
9744,Looking for companies that provide mining related products and services.,,2
9743,Looking for companies that provide mining related products and services.,,2
9742,Looking for provider of integrated Water| Energy| and Air solutions which add sustainable value  to our Customers| Owners| Employees and Communities. Products of interest:-Water TreatmentChemical Process Industry SolutionsDisinfection| Hygiene & SanitationDust Control TechnologiesFuel AdditivesMembrane SeparationsOdour Control,,2
9741,We are looking for agrochemical solution service provider like insecticides| fungicides| herbicides| adjuvants and plant nutritional products.,,2
9740,We are looking for agrochemical solution service provider like insecticides| fungicides| herbicides| adjuvants and plant nutritional products.,,2
9739,Specialty ingredients and commodities| offering products and services to the bakery| beverage| dairy| health and nutrition| meat| poultry and wine industries. Products include bacterial cultures| enzymes| natural colours| test systems| phosphates| stabilisers| emulsifiers| baking powders| brines| spice blends| marinades and various other food ingredients.,,2
9738,We are looking for F&B companies that manufacture and distribute juice-based drinks and products like Formulated Compounds| Juice Blends| Emulsions| Juice Concentrates & Purees etc.,,2
9737,Interested in chemical companies in Pigments & Additives| Polymers| industrial cleaning| agricultural| water treatment| lubricant| Animal Health & Nutrition| Sulphuric acid and sulphur-based chemicals etc.,,2
9736,Interested in chemical companies in Pigments & Additives| Polymers| industrial cleaning| agricultural| water treatment| lubricant| Animal Health & Nutrition| Sulphuric acid and sulphur-based chemicals etc.,,2
9735,We are looking for a broad range of specialty nylon yarn companies catering to industrial clients.,,2
9734,Headquartered in Europe| this global food products company focuses on dairy| health and nutrition products.Requirement :It is looking to acquire other food product companies globally with the preferred regions being APAC and Middle East. The prospective target should be operating in either of the below mentioned businesses in the F&B Sector :1) Fresh Dairy Products         ( Yogurt| curd| milk)2)Water                                  ( Mineral and distilled water| areated water to be excluded)3)Medical nutrition products( Innovative nutrition products for elderly patients)4)Nutrition foods for babies/mothers (for diff cycles of pregnancy and for children through each stage of development: Milk| nutrition powders| health food),,2
9733,Looking for companies that provide chemical for mining related activities like commercial explosives for mining| quarrying and construction markets.,,2
9732,We are looking for molecular diagnostics companies that help in treatment of  diseases like cancer. Revenue growth of the company should be over 10% and annual cash burn less than USD10M. We are not looking for diagnostics centers| looking for labs.,,2
9731,We are looking for textile manufacturing  companies engaged in apparel or home furnishing products like  of Yarn| Greige and Processed Fabric| Sewing Thread| Acrylic fibre etc. We are open to distressed opportunities as well.,,2
9730,Headquartered in the United States| this company is into the business of specialty chemicals with focus on paints| coatings and materials.It's current businesses include : Architectural Paint| Fiber Glass| Optical Products| Silicas| Aerospace Transparencies| Sealants and Coatings| Industrial Coatings| Packaging Coatings| Industrial Coatings Services| Automotive Coatings| and Protective and Marine Coatings.Requirement : The company is looking to acquire other companies that manufacture specialty chemicals| in either of the above mentioned businesses.,,2
9729,We seek companies either in mobility (wheelchairs) or non invasive orthopedics (orthotics like knee braces and supports| lumbar supports).,,2
9728,Looking for digital media| content and advertising companies.,,2
9726,We are an integrated marketing firm that provides advertising| marketing| and corporate communications services. Right now we are targeting companies with capabilities in Shopper marketing ( understanding how one's target consumers behave as shoppers| in different channels and formats| and leveraging this intelligence) especially in e-commerce and data analytics.,,2
9724,We are looking for companies that source| store| ship and distribute agricultural products including coffee| sugar| molasses| pulses and grains.,,2
9723,About the acquirer :This software solutions provider| based out of India| specialises in providing transaction banking and lending products to the financial services industry| on a global platform. The company was one of the initial few providers of retail and corporate banking softwares in the industry.Requirement :The company is looking at global acquisitions in the areas of Mobility| Analytics| CRM| Corporate GL| Real time Payments| Trade front-end| Portal capability on web-top Payment hub| under transaction banking and lending software solutions for the financial services sector.Geographical preference : Global with a preference that the target companies should have customers in Asia (India)| South East Asia| Middle East| ANZ| Europe| Africa and Americas (in the same order).,,2
9722,Founded in 1984| the group has developed to be the leader of Chinese industrial electrical equipment production and clean energy fields. It has a total assets of USD7.1 Bn and 30|000 employees| 97 oversea subsidiaries| more than 2|300 distributors and more than USD7.3Bn revenue in 2015.Looking for synergistic opportunities from manufacturing space.,Founded in 1984| the group has developed to be the leader of Chinese industrial electrical equipment production and clean energy fields. It has a total assets of USD7.1 Bn and 30|000 employees| 97 oversea subsidiaries| more than 2|300 distributors and more than USD7.3Bn revenue in 2015.,2
9721,We are looking for companies that provide clinical| financial| and operations software solutions for the skilled nursing| senior living| home care & long-term care industries.,,2
9718,We are looking for near production or advanced exploration precious metals projects| mostly in the silver sector.,,2
9716,Headquartered in the United States| this company is a leading provider of independent advisory services| software and data solutions to the global commercial real estate industry. These solutions empower clients to analyze| gain market insight and recognize value on their real estate investments.The company is looking to acquire providers of such data analytics| research and software solutions| serving the commercial real estate industry. A few examples of such solutions include ; Data consolidation and security| data collection and management| construction contract solutions| cost management| asset financial reporting| property tax schedules etc.,,2
9714,We are looking for optoelectronics companies in segments: Lasers & Material Processing| Optical Systems| Industrial Metrology| Traffic Solutions and Defense & Civil Systems.Applications are Electric Power Supply and Drive Systems| Industrial Metrology| Cameras and Camera Modules| Laser and Laser Technology| LED lighting| Aviation Systems| Optics and Optical Systems| Optoelectronics and Optoelectronic Systems| Defense and Security Technology and Traffic Safety Systems,,2
9713,Headquartered in the United States| the company is a managed leading service provider for IoT and M2M and aims to simplify the development and deployment of the Internet of Things (IoT) and Machine-to-Machine (M2M) applications across the globe.Currently| it is looking to acquire similar companies that provide technological solutions focused on Internet of Things| with applications in Security and services and device management : integrated IoT wireless security solutions that combine video| still picture| dispatched voice| and IoT remote sensor data services.Other secondary requirements are for IoT in healthcare| payments and transactions| insurance etc.,,2
